{
  "candidate_execution": "NOT_STARTED",
  "controlled_manifest": {
    "git_policy": "CONTROLLED_DO_NOT_COMMIT",
    "sha256": "24d3747cbcec7b5a22c7842ac92851a672dcdbe8b256e616c0abf1195dd42a9a",
    "size_bytes": 15100
  },
  "conversion_runtime": {
    "architecture": "x86_64",
    "components": [
      {
        "path": "/usr/lib/x86_64-linux-gnu/gstreamer-1.0/libgstmpg123.so",
        "sha256": "ea45afa94259b3298cd80b3e385e16fb057652db6de353cabac7a1bb228aa2c1"
      },
      {
        "path": "/usr/lib/x86_64-linux-gnu/gstreamer-1.0/libgstaudioresample.so",
        "sha256": "e4ff626919e0d4ba9a4a105dd0d4acbb0608e80d759a513509c0f3ec6a70d1b7"
      },
      {
        "path": "/usr/lib/x86_64-linux-gnu/gstreamer-1.0/libgstwavenc.so",
        "sha256": "d4e487b72a09808d46f78d764948800dd33a9070f03d38430bebf46e97a2d6a1"
      },
      {
        "path": "/usr/lib/x86_64-linux-gnu/libmpg123.so.0.48.2",
        "sha256": "af6e041af88719710b77d83b7deb8ecbe10bdf67a255fcadcfae7eec1d19eea6"
      },
      {
        "path": "/usr/lib/x86_64-linux-gnu/libgstreamer-1.0.so.0.2402.0",
        "sha256": "4207e0d9abcbcf3245aecc582c543d456cea131c4ed3a1d7033eea84150704b0"
      }
    ],
    "pipeline": [
      "filesrc",
      "mpegaudioparse",
      "mpg123audiodec",
      "audioconvert",
      "audioresample quality=10",
      "audio/x-raw,format=S16LE,rate=16000,channels=1,layout=interleaved",
      "wavenc",
      "filesink"
    ],
    "runtime": "GStreamer",
    "version": "1.24.2"
  },
  "fixture_lock_id": "M4A-M2A-FIXTURE-LOCK-001",
  "packet_id": "M4A-M2A-COMMON-PACKET-001",
  "pcm": {
    "channels": 1,
    "sample_format": "S16_LE",
    "sample_rate_hz": 16000
  },
  "records": {
    "common_voice": [
      {
        "clip_id": "common_voice_zh-TW_17452147.mp3",
        "derivation": "gstreamer_mpg123_decode_resample_16k_mono_s16le",
        "derived_wav_sha256": "03907dc7d28ef52e7843e6b3af0af169a1b5a71c011d2e416ced73043935fa26",
        "derived_wav_size_bytes": 83768,
        "duration_seconds": 2.616,
        "frames": 41856,
        "reference_sha256": "a57e588ce438c326e86f078095f6c4a44a31cc80009db855504c54a1b2a53655",
        "selection_rank_sha256": "000365c0991d6e3f5f85c5c1f4b8efad74b7802fa3ad92ea8b9438aff98873b8",
        "source_mp3_sha256": "29be1bd04fd1499c44c66fb079e9120aa311adedb1bfd9bc49ffdb13142e1c42"
      },
      {
        "clip_id": "common_voice_zh-TW_17630166.mp3",
        "derivation": "gstreamer_mpg123_decode_resample_16k_mono_s16le",
        "derived_wav_sha256": "41f4be554ebbbbe65874d4eadffa58beb2272a849cf3734aacbb7a67811775b2",
        "derived_wav_size_bytes": 49976,
        "duration_seconds": 1.56,
        "frames": 24960,
        "reference_sha256": "d54b76ff27a275fd04fce432c5f9842b6fef702be2b3386699f3fd53c34a776d",
        "selection_rank_sha256": "00048a0a06be4803d34f6ec214e3648c881d2ce7adc7919075090c862be4c667",
        "source_mp3_sha256": "ada3a3190767445572d2c14aa6fb0f5ffd1b6ccc705542346db333b41ec14f5e"
      },
      {
        "clip_id": "common_voice_zh-TW_30584899.mp3",
        "derivation": "gstreamer_mpg123_decode_resample_16k_mono_s16le",
        "derived_wav_sha256": "e48859c817ddb0947f8e79b0e1c12c0e5ffdae9c708262e50b06bbdeced54614",
        "derived_wav_size_bytes": 127928,
        "duration_seconds": 3.996,
        "frames": 63936,
        "reference_sha256": "39b3211582a2f0f7ee3c858b8f609dd30be0dc537d5fe9e02835ed50d83b6da4",
        "selection_rank_sha256": "00060aafa4eeae3fa21a5ab04055f5de218a332f16d2a358e10661f5d824615f",
        "source_mp3_sha256": "2afa719a1c59c4e54967d0813ccbff2bf5de26f6a102d5f6ef05d4ce01dda200"
      },
      {
        "clip_id": "common_voice_zh-TW_19306415.mp3",
        "derivation": "gstreamer_mpg123_decode_resample_16k_mono_s16le",
        "derived_wav_sha256": "dc253a814fdcae77ab7103f7c358854bef7888b52b2b5a0fad1faa7ab7a34381",
        "derived_wav_size_bytes": 146744,
        "duration_seconds": 4.584,
        "frames": 73344,
        "reference_sha256": "2f4aa60978c4b295ab37d703cd7b13c36c59e3ad598c8f6a7849702883a1b7d9",
        "selection_rank_sha256": "000618790eba9b6732945b969b703adcc95a96b3b186a59d4b84f38a3ba4e8d5",
        "source_mp3_sha256": "934a3ffc99867f4408ef07fb07cd29f005d42a3a1fb223767d50db73c4f9c5ec"
      },
      {
        "clip_id": "common_voice_zh-TW_18740696.mp3",
        "derivation": "gstreamer_mpg123_decode_resample_16k_mono_s16le",
        "derived_wav_sha256": "b17fe96e43ea9d35e23510a21a5abe886175db1c4a32d80af44e9872125d38ef",
        "derived_wav_size_bytes": 179000,
        "duration_seconds": 5.592,
        "frames": 89472,
        "reference_sha256": "c958bbe8c72a80cb546f6a1bf50b91e4add701b145a1fe2fa8f12055df5aeefa",
        "selection_rank_sha256": "00082065c160a7ac342206433b196cb5b82848b87bfa1de7fd6ce066ef46341d",
        "source_mp3_sha256": "1dfec473f064607104ee78c7c109ce85feb80ef2d32b6ad378eeccbbeb1c5641"
      },
      {
        "clip_id": "common_voice_zh-TW_19057680.mp3",
        "derivation": "gstreamer_mpg123_decode_resample_16k_mono_s16le",
        "derived_wav_sha256": "bff3acbda888398fce29b2e549026213a0cf5c8fb86e148c6ed52536fd8cfcdd",
        "derived_wav_size_bytes": 281144,
        "duration_seconds": 8.784,
        "frames": 140544,
        "reference_sha256": "49297043e7a872fdd75d022ca1c18b0f631b0a3b21395496de625f6ef9ed1d89",
        "selection_rank_sha256": "0008680a992f23de2be6fb1fe3550504d461d914276ba8b2cc3aa9cee5517af4",
        "source_mp3_sha256": "8d659fddd0580788dc9d845dfbbbb09ad9b34e0413803d15317c2fd117b12364"
      },
      {
        "clip_id": "common_voice_zh-TW_31328179.mp3",
        "derivation": "gstreamer_mpg123_decode_resample_16k_mono_s16le",
        "derived_wav_sha256": "474331691bf0af3669197e3287cda3c44e964515b038fe145c4dd65b8ea8df72",
        "derived_wav_size_bytes": 69176,
        "duration_seconds": 2.16,
        "frames": 34560,
        "reference_sha256": "efeec755ac7e52fd3c65471a6661ff174789e32ff6fe52e797721fd4b7667785",
        "selection_rank_sha256": "0008df419587beb4e2a940aff9d652f8488dc6f7adac5406567aa2fde196fa5b",
        "source_mp3_sha256": "cf8f823cd618a1cf84bc4732e128dc4006fbe69290097791aba88339c5eba569"
      },
      {
        "clip_id": "common_voice_zh-TW_19313472.mp3",
        "derivation": "gstreamer_mpg123_decode_resample_16k_mono_s16le",
        "derived_wav_sha256": "4c9d8baf920b5b75e8d4f0fdd8ee128670cc0ca6474af215cc980cf0873b3615",
        "derived_wav_size_bytes": 220472,
        "duration_seconds": 6.888,
        "frames": 110208,
        "reference_sha256": "d486a21d357a87511b9c81b52195c62c9bbd3b5cc020148dacd36f55894175c7",
        "selection_rank_sha256": "00099a24e95af3e31ca590a4d51a15c67006f5f18967466cc19c7ba8b05ade60",
        "source_mp3_sha256": "601d61952ae9402b2fda2cf76d5cd89baa90e588fcbf51bf69b14ac97f50942d"
      },
      {
        "clip_id": "common_voice_zh-TW_20850655.mp3",
        "derivation": "gstreamer_mpg123_decode_resample_16k_mono_s16le",
        "derived_wav_sha256": "8fc0e74cb2c289c936a8557c15017e4ecd5ef5d55460ce73b179b039b0f1f020",
        "derived_wav_size_bytes": 185144,
        "duration_seconds": 5.784,
        "frames": 92544,
        "reference_sha256": "448c7cc72c10a6cd2c4168aab5afcdcef3edc9fa2f668c0d627cee5bf20a0cf2",
        "selection_rank_sha256": "000a4eb5b6aa6b16263d36c8efa4e17089aa7810c629ebfbc7f3a85f3c41845b",
        "source_mp3_sha256": "2caa7e099bdd8361e92a05ca8049e788d24106226af31ec36458442bd9ff1558"
      },
      {
        "clip_id": "common_voice_zh-TW_26206663.mp3",
        "derivation": "gstreamer_mpg123_decode_resample_16k_mono_s16le",
        "derived_wav_sha256": "42a035b498309495f1267d011632ab43b30bf8ed06621fcd5956fc23e0274e97",
        "derived_wav_size_bytes": 100280,
        "duration_seconds": 3.132,
        "frames": 50112,
        "reference_sha256": "36c17bde71c99ad48c9ba91834904f6949ad5107e03be1710316e52c9e737787",
        "selection_rank_sha256": "000a8c0c289f27b055973304698a50cd93d3cb256fd5f5bc0eb49a4882fb88e6",
        "source_mp3_sha256": "bea6a00117315743822078180b134c925f59733e0c1bde74cedf4b9ed4abbcd7"
      },
      {
        "clip_id": "common_voice_zh-TW_22964558.mp3",
        "derivation": "gstreamer_mpg123_decode_resample_16k_mono_s16le",
        "derived_wav_sha256": "0e0cfb0c0a9385a64007f666aff42d2689793392ac8755ecef1b15e78a74cb50",
        "derived_wav_size_bytes": 131384,
        "duration_seconds": 4.104,
        "frames": 65664,
        "reference_sha256": "9c96aff3008bfaeb23503e4a3649043ee128a0fd00de94ea79d7b9dfd2985051",
        "selection_rank_sha256": "000c07692c10a81221d3ee4b8806a09e561933490acf7e94bd5c3b941a25fe05",
        "source_mp3_sha256": "3a43ea06b94c2311197d429c5670c05aaa6e699376ca00ace18965df4a6d02b2"
      },
      {
        "clip_id": "common_voice_zh-TW_17414953.mp3",
        "derivation": "gstreamer_mpg123_decode_resample_16k_mono_s16le",
        "derived_wav_sha256": "fafa14a62351bc0c1be43d536fc06647cc28b29deb827c5647a0322452196227",
        "derived_wav_size_bytes": 85304,
        "duration_seconds": 2.664,
        "frames": 42624,
        "reference_sha256": "cd30d050b4b35f4dd4bd403cc4e3667f2cf8977317d98ac71bf391b9126677ae",
        "selection_rank_sha256": "000e6aab91f4da833f6dad10776ce105df177e7fb9ebbc2474b2119cc6f67517",
        "source_mp3_sha256": "2fd8da77194435466a023140200a7e47b3b82e564c09620b16a52ba381c73c31"
      }
    ],
    "internal": [
      {
        "derivation": "contiguous_first_speech_start_to_last_speech_end_preserve_pause",
        "derived_wav_sha256": "a83e40a14e35035a6a3c9cc4a0189aa01f9988b0711f9749085aded2e953767b",
        "derived_wav_size_bytes": 141164,
        "duration_seconds": 4.41,
        "fixture_id": "asr-pause-027",
        "frames": 70560,
        "group": "taiwan_mandarin",
        "reference_sha256": "4153dfe1c84a69f6a05aa1c61e8e21cecbdfbdb12371aeb35e72d783d568a8f7",
        "source_wav_sha256": "bd0e1225242e050501fa5a5e0ce8d4db650089544aab22607d484e7ba7053a43"
      },
      {